{
  "schema": "wang-region-snapshot-v1",
  "geometry": "square",
  "source_formula_sha256": "ea2b8feb6eb8f4e722f1ec9021445c84858120c8567d42528631bdfb77400a94",
  "bounds": {
    "min_x_inclusive": 0,
    "min_y_inclusive": 0,
    "max_x_inclusive": 40,
    "max_y_inclusive": 14
  },
  "active": [
    true,
    true,
    true,
    true,
    true,
    true,
    true,
    true,
    true,
    true,
    true,
    true,
    true,
    true,
    true,
    true,
    true,
    true,
    true,
    true,
    true,
    true,
    true,
    true,
    true,
    true,
    true,
    true,
    true,
    true,
    true,
    true,
    true,
    true,
    true,
    true,
    true,
    true,
    true,
    true,
    false,
    true,
    true,
    true,
    true,
    true,
    true,
    true,
    true,
    true,
    true,
    true,
    true,
    true,
    true,
    true,
    true,
    true,
    true,
    true,
    true,
    true,
    true,
    true,
    true,
    true,
    true,
    true,
    true,
    true,
    true,
    true,
    true,
    true,
    true,
    true,
    true,
    true,
    true,
    true,
    true,
    true,
    true,
    true,
    true,
    true,
    true,
    true,
    true,
    true,
    true,
    true,
    true,
    true,
    true,
    true,
    true,
    true,
    true,
    true,
    true,
    true,
    true,
    true,
    true,
    true,
    true,
    true,
    true,
    true,
    true,
    true,
    true,
    true,
    true,
    true,
    true,
    true,
    true,
    true,
    true,
    true,
    true,
    true,
    true,
    true,
    true,
    true,
    true,
    true,
    true,
    true,
    true,
    true,
    true,
    true,
    true,
    true,
    true,
    true,
    true,
    true,
    true,
    true,
    true,
    true,
    true,
    true,
    true,
    true,
    true,
    true,
    true,
    true,
    true,
    true,
    true,
    true,
    true,
    true,
    true,
    true,
    false,
    false,
    true,
    true,
    true,
    true,
    true,
    true,
    true,
    true,
    true,
    true,
    true,
    true,
    true,
    true,
    true,
    true,
    true,
    true,
    true,
    true,
    true,
    true,
    true,
    true,
    true,
    true,
    true,
    true,
    true,
    true,
    true,
    true,
    true,
    true,
    true,
    true,
    true,
    true,
    true,
    true,
    false,
    true,
    true,
    true,
    true,
    true,
    true,
    true,
    true,
    true,
    true,
    true,
    true,
    true,
    true,
    true,
    true,
    true,
    true,
    true,
    true,
    true,
    true,
    true,
    true,
    true,
    true,
    true,
    true,
    true,
    true,
    true,
    true,
    true,
    true,
    true,
    true,
    true,
    true,
    true,
    true,
    true,
    true,
    true,
    true,
    true,
    true,
    true,
    true,
    true,
    true,
    true,
    true,
    true,
    true,
    true,
    true,
    true,
    true,
    true,
    true,
    true,
    true,
    true,
    true,
    true,
    true,
    true,
    true,
    true,
    true,
    true,
    true,
    true,
    true,
    true,
    true,
    true,
    true,
    true,
    true,
    true,
    true,
    true,
    true,
    true,
    true,
    true,
    true,
    true,
    true,
    true,
    true,
    true,
    true,
    true,
    true,
    true,
    true,
    true,
    true,
    true,
    true,
    true,
    true,
    true,
    true,
    true,
    true,
    true,
    true,
    true,
    true,
    true,
    true,
    true,
    true,
    true,
    true,
    true,
    true,
    true,
    false,
    false,
    true,
    true,
    true,
    true,
    true,
    true,
    true,
    true,
    true,
    true,
    true,
    true,
    true,
    true,
    true,
    true,
    true,
    true,
    true,
    true,
    true,
    true,
    true,
    true,
    true,
    true,
    true,
    true,
    true,
    true,
    true,
    true,
    true,
    true,
    true,
    true,
    true,
    true,
    true,
    true,
    false,
    true,
    true,
    true,
    true,
    true,
    true,
    true,
    true,
    true,
    true,
    true,
    true,
    true,
    true,
    true,
    true,
    true,
    true,
    true,
    true,
    true,
    true,
    true,
    true,
    true,
    true,
    true,
    true,
    true,
    true,
    true,
    true,
    true,
    true,
    true,
    true,
    true,
    true,
    true,
    true,
    true,
    true,
    true,
    true,
    true,
    true,
    true,
    true,
    true,
    true,
    true,
    true,
    true,
    true,
    true,
    true,
    true,
    true,
    true,
    true,
    true,
    true,
    true,
    true,
    true,
    true,
    true,
    true,
    true,
    true,
    true,
    true,
    true,
    true,
    true,
    true,
    true,
    true,
    true,
    true,
    true,
    true,
    true,
    true,
    true,
    true,
    true,
    true,
    true,
    true,
    true,
    true,
    true,
    true,
    true,
    true,
    true,
    true,
    true,
    true,
    true,
    true,
    true,
    true,
    true,
    true,
    true,
    true,
    true,
    true,
    true,
    true,
    true,
    true,
    true,
    true,
    true,
    true,
    true,
    true,
    true,
    false,
    false,
    true,
    true,
    true,
    true,
    true,
    true,
    true,
    true,
    true,
    true,
    true,
    true,
    true,
    true,
    true,
    true,
    true,
    true,
    true,
    true,
    true,
    true,
    true,
    true,
    true,
    true,
    true,
    true,
    true,
    true,
    true,
    true,
    true,
    true,
    true,
    true,
    true,
    true,
    true,
    true,
    false,
    true,
    true,
    true,
    true,
    true,
    true,
    true,
    true,
    true,
    true,
    true,
    true,
    true,
    true,
    true,
    true,
    true,
    true,
    true,
    true,
    true,
    true,
    true,
    true,
    true,
    true,
    true,
    true,
    true,
    true,
    true,
    true,
    true,
    true,
    true,
    true,
    true,
    true,
    true,
    true,
    true,
    true,
    true,
    true,
    true,
    true,
    true,
    true,
    true,
    true,
    true,
    true,
    true,
    true,
    true,
    true,
    true,
    true,
    true,
    true,
    true,
    true,
    true,
    true,
    true,
    true,
    true,
    true,
    true,
    true,
    true,
    true,
    true,
    true,
    true,
    true,
    true,
    true,
    true,
    true,
    true,
    true
  ],
  "boundary": [
    {
      "N": 0,
      "E": null,
      "S": null,
      "W": 1
    },
    {
      "N": 0,
      "E": null,
      "S": null,
      "W": null
    },
    {
      "N": 0,
      "E": null,
      "S": null,
      "W": null
    },
    {
      "N": 0,
      "E": null,
      "S": null,
      "W": null
    },
    {
      "N": 0,
      "E": null,
      "S": null,
      "W": null
    },
    {
      "N": 0,
      "E": null,
      "S": null,
      "W": null
    },
    {
      "N": 6,
      "E": null,
      "S": null,
      "W": null
    },
    {
      "N": 0,
      "E": null,
      "S": null,
      "W": null
    },
    {
      "N": 0,
      "E": null,
      "S": null,
      "W": null
    },
    {
      "N": 6,
      "E": null,
      "S": null,
      "W": null
    },
    {
      "N": 0,
      "E": null,
      "S": null,
      "W": null
    },
    {
      "N": 0,
      "E": null,
      "S": null,
      "W": null
    },
    {
      "N": 0,
      "E": null,
      "S": null,
      "W": null
    },
    {
      "N": 6,
      "E": null,
      "S": null,
      "W": null
    },
    {
      "N": 0,
      "E": null,
      "S": null,
      "W": null
    },
    {
      "N": 0,
      "E": null,
      "S": null,
      "W": null
    },
    {
      "N": 0,
      "E": null,
      "S": null,
      "W": null
    },
    {
      "N": 0,
      "E": null,
      "S": null,
      "W": null
    },
    {
      "N": 0,
      "E": null,
      "S": null,
      "W": null
    },
    {
      "N": 0,
      "E": null,
      "S": null,
      "W": null
    },
    {
      "N": 0,
      "E": null,
      "S": null,
      "W": null
    },
    {
      "N": 6,
      "E": null,
      "S": null,
      "W": null
    },
    {
      "N": 0,
      "E": null,
      "S": null,
      "W": null
    },
    {
      "N": 0,
      "E": null,
      "S": null,
      "W": null
    },
    {
      "N": 0,
      "E": null,
      "S": null,
      "W": null
    },
    {
      "N": 0,
      "E": null,
      "S": null,
      "W": null
    },
    {
      "N": 0,
      "E": null,
      "S": null,
      "W": null
    },
    {
      "N": 0,
      "E": null,
      "S": null,
      "W": null
    },
    {
      "N": 6,
      "E": null,
      "S": null,
      "W": null
    },
    {
      "N": 0,
      "E": null,
      "S": null,
      "W": null
    },
    {
      "N": 0,
      "E": null,
      "S": null,
      "W": null
    },
    {
      "N": 0,
      "E": null,
      "S": null,
      "W": null
    },
    {
      "N": 0,
      "E": null,
      "S": null,
      "W": null
    },
    {
      "N": 0,
      "E": null,
      "S": null,
      "W": null
    },
    {
      "N": 0,
      "E": null,
      "S": null,
      "W": null
    },
    {
      "N": 0,
      "E": null,
      "S": null,
      "W": null
    },
    {
      "N": 6,
      "E": null,
      "S": null,
      "W": null
    },
    {
      "N": 0,
      "E": null,
      "S": null,
      "W": null
    },
    {
      "N": 0,
      "E": null,
      "S": null,
      "W": null
    },
    {
      "N": 0,
      "E": 4,
      "S": null,
      "W": null
    },
    null,
    {
      "N": null,
      "E": null,
      "S": null,
      "W": 1
    },
    {
      "N": null,
      "E": null,
      "S": null,
      "W": null
    },
    {
      "N": null,
      "E": null,
      "S": null,
      "W": null
    },
    {
      "N": null,
      "E": null,
      "S": null,
      "W": null
    },
    {
      "N": null,
      "E": null,
      "S": null,
      "W": null
    },
    {
      "N": null,
      "E": null,